{
  "$schema": "./schema/screens.schema.json",
  "version": "1.0.0",
  "generated": "2026-04-26",
  "generatedBy": "claude/ui-prototype-route-inventory",
  "sources": {
    "router": "docs/design/claude-export/design-system/app.html (SCREENS object L60-L109)",
    "prototype": "docs/design-references/tempo-flow-2026-04-18/TempoFlow Prototype.html",
    "designSystem": "docs/design/claude-export/design-system/",
    "navConstants": "apps/web/lib/tempo-nav.ts"
  },
  "statusLegend": {
    "missing": "no route file in the repo yet",
    "scaffold": "ScaffoldScreen placeholder; no real port yet",
    "partial": "real component exists but only covers part of the prototype",
    "ported": "fully ported from prototype, awaiting backend wiring",
    "wired": "ported AND wired to a Convex query/mutation/action",
    "shipped": "shipped-and-running per docs/SHIP_STATE.md"
  },
  "ownerAgents": {
    "claude-web-1": "this agent — inventory + route metadata",
    "claude-web-flow": "Flow category screens (today, daily-note, brain-dump, coach, plan)",
    "claude-web-library": "Library category screens (tasks, notes, journal, calendar, habits, routines, goals, projects)",
    "claude-web-you": "You category screens (insights, activity, templates, search, command, empty-states)",
    "claude-web-settings": "Settings category screens",
    "claude-web-marketing": "Landing / about / changelog",
    "claude-web-onboarding": "sign-in / onboarding / paywall",
    "claude-web-templates": "template-builder, template-run, template-editor, template-sketch",
    "claude-mobile": "apps/mobile screens",
    "codex-desktop": "human-driven design polish + final integration"
  },
  "platforms": ["web", "mobile"],
  "screens": [
    {
      "slug": "daily-note",
      "title": "Daily Note",
      "category": "Flow",
      "platform": "web",
      "bare": true,
      "route": "/daily-note",
      "currentRoute": "apps/web/app/(bare)/daily-note/page.tsx",
      "sourceFiles": ["screens-7.jsx#ScreenDailyNote"],
      "status": "scaffold",
      "owner": "claude-web-flow",
      "priority": "P1",
      "icon": "Notebook",
      "queries": ["journal.getDaily"],
      "mutations": ["journal.updateDaily"],
      "auth": "required",
      "notes": "Distraction-free single-textarea surface. Bare layout — no sidebar/topbar."
    },
    {
      "slug": "today",
      "title": "Today",
      "category": "Flow",
      "platform": "web",
      "route": "/today",
      "currentRoute": "apps/web/app/(tempo)/today/page.tsx",
      "sourceFiles": ["screens-1.jsx#ScreenToday"],
      "status": "partial",
      "owner": "claude-web-flow",
      "priority": "P0",
      "icon": "Home",
      "queries": ["tasks.listToday", "habits.listForToday", "journal.getDaily"],
      "mutations": ["tasks.complete", "tasks.create", "habits.toggle"],
      "auth": "required",
      "notes": "Most-implemented screen. TodayScreen exists with greeting, quick-add, task list, brain dump. Re-check parity with prototype: greeting time-of-day, energy slider, schedule strip."
    },
    {
      "slug": "brain-dump",
      "title": "Brain Dump",
      "category": "Flow",
      "platform": "web",
      "route": "/brain-dump",
      "currentRoute": "apps/web/app/(tempo)/brain-dump/page.tsx",
      "sourceFiles": ["screens-1.jsx#ScreenBrainDump"],
      "status": "scaffold",
      "owner": "claude-web-flow",
      "priority": "P0",
      "icon": "Sparkles",
      "queries": ["brainDump.recent"],
      "mutations": ["brainDump.create", "brainDump.parse"],
      "actions": ["coach.parseBrainDump"],
      "auth": "required",
      "notes": "Free-form capture → AI parse into tasks/notes/journal. Accept-reject flow per HARD_RULES §6.2."
    },
    {
      "slug": "coach",
      "title": "Coach",
      "category": "Flow",
      "platform": "web",
      "route": "/coach",
      "currentRoute": "apps/web/app/(tempo)/coach/page.tsx",
      "sourceFiles": ["screens-1.jsx#ScreenCoach", "coach-dock.jsx"],
      "status": "scaffold",
      "owner": "claude-web-flow",
      "priority": "P1",
      "icon": "Heart",
      "queries": ["coach.threadList", "coach.messages"],
      "mutations": ["coach.sendMessage"],
      "actions": ["coach.streamReply"],
      "auth": "required",
      "streaming": true,
      "notes": "Coach panel + dock. Voice-toggle for walkie-talkie / live (HARD_RULES §9). Confidence-routed proposals (HARD_RULES §6.3)."
    },
    {
      "slug": "plan",
      "title": "Planning",
      "category": "Flow",
      "platform": "web",
      "route": "/plan",
      "currentRoute": "apps/web/app/(tempo)/plan/page.tsx",
      "sourceFiles": ["screens-1.jsx#ScreenPlan"],
      "status": "scaffold",
      "owner": "claude-web-flow",
      "priority": "P2",
      "icon": "Layout",
      "queries": ["plan.getWeek"],
      "mutations": ["plan.update", "plan.commit"],
      "actions": ["coach.generatePlan"],
      "auth": "required",
      "notes": "Coach-assisted weekly planning view."
    },
    {
      "slug": "tasks",
      "title": "Tasks",
      "category": "Library",
      "platform": "web",
      "route": "/tasks",
      "currentRoute": "apps/web/app/(tempo)/tasks/page.tsx",
      "sourceFiles": ["screens-1.jsx#ScreenTasks"],
      "status": "scaffold",
      "owner": "claude-web-library",
      "priority": "P0",
      "icon": "CheckSquare",
      "queries": ["tasks.list", "tasks.byProject"],
      "mutations": ["tasks.complete", "tasks.create", "tasks.update", "tasks.archive"],
      "auth": "required",
      "notes": "Tasks inbox with filters and grouping. CURRENT scaffold @source incorrectly says screens-2.jsx — corrected here to screens-1.jsx."
    },
    {
      "slug": "notes",
      "title": "Notes",
      "category": "Library",
      "platform": "web",
      "route": "/notes",
      "currentRoute": "apps/web/app/(tempo)/notes/page.tsx",
      "sourceFiles": ["screens-2.jsx#ScreenNotes"],
      "status": "scaffold",
      "owner": "claude-web-library",
      "priority": "P1",
      "icon": "BookOpen",
      "queries": ["notes.list"],
      "mutations": ["notes.create", "notes.update", "notes.archive"],
      "auth": "required"
    },
    {
      "slug": "note-detail",
      "title": "Note · editor",
      "category": "Library",
      "platform": "web",
      "route": "/notes/[id]",
      "currentRoute": "apps/web/app/(tempo)/notes/[id]/page.tsx",
      "sourceFiles": ["screens-2.jsx#ScreenNoteDetail"],
      "status": "scaffold",
      "owner": "claude-web-library",
      "priority": "P1",
      "icon": "Edit",
      "queries": ["notes.get"],
      "mutations": ["notes.update"],
      "auth": "owner",
      "notes": "Dynamic route. Missing from tempo-nav.ts — added by this run."
    },
    {
      "slug": "journal",
      "title": "Journal",
      "category": "Library",
      "platform": "web",
      "route": "/journal",
      "currentRoute": "apps/web/app/(tempo)/journal/page.tsx",
      "sourceFiles": ["screens-2.jsx#ScreenJournal"],
      "status": "scaffold",
      "owner": "claude-web-library",
      "priority": "P1",
      "icon": "Book",
      "queries": ["journal.list", "journal.byMonth"],
      "mutations": ["journal.create", "journal.update"],
      "auth": "required"
    },
    {
      "slug": "calendar",
      "title": "Calendar",
      "category": "Library",
      "platform": "web",
      "route": "/calendar",
      "currentRoute": "apps/web/app/(tempo)/calendar/page.tsx",
      "sourceFiles": ["screens-2.jsx#ScreenCalendar"],
      "status": "scaffold",
      "owner": "claude-web-library",
      "priority": "P2",
      "icon": "Calendar",
      "queries": ["calendar.events", "tasks.scheduled"],
      "mutations": [],
      "auth": "required",
      "notes": "Scaffold @source claims screens-3.jsx — corrected to screens-2.jsx."
    },
    {
      "slug": "habits",
      "title": "Habits",
      "category": "Library",
      "platform": "web",
      "route": "/habits",
      "currentRoute": "apps/web/app/(tempo)/habits/page.tsx",
      "sourceFiles": ["screens-2.jsx#ScreenHabits"],
      "status": "scaffold",
      "owner": "claude-web-library",
      "priority": "P1",
      "icon": "Flame",
      "queries": ["habits.list", "habits.streaks"],
      "mutations": ["habits.toggle", "habits.create"],
      "auth": "required",
      "notes": "Streak rings (HabitRing primitive). Scaffold @source claims screens-3.jsx — corrected to screens-2.jsx."
    },
    {
      "slug": "habit-detail",
      "title": "Habit detail",
      "category": "Library",
      "platform": "web",
      "route": "/habits/[id]",
      "currentRoute": "apps/web/app/(tempo)/habits/[id]/page.tsx",
      "sourceFiles": ["screens-2.jsx#ScreenHabitDetail"],
      "status": "scaffold",
      "owner": "claude-web-library",
      "priority": "P2",
      "icon": "Flame",
      "queries": ["habits.get", "habits.history"],
      "mutations": ["habits.toggle", "habits.update"],
      "auth": "owner",
      "notes": "Dynamic route. Missing from tempo-nav.ts — added by this run."
    },
    {
      "slug": "routines",
      "title": "Routines",
      "category": "Library",
      "platform": "web",
      "route": "/routines",
      "currentRoute": "apps/web/app/(tempo)/routines/page.tsx",
      "sourceFiles": ["screens-2.jsx#ScreenRoutines"],
      "status": "scaffold",
      "owner": "claude-web-library",
      "priority": "P2",
      "icon": "Repeat",
      "queries": ["routines.list"],
      "mutations": ["routines.create", "routines.update"],
      "auth": "required",
      "notes": "Scaffold @source claims screens-3.jsx — corrected to screens-2.jsx."
    },
    {
      "slug": "routine-detail",
      "title": "Routine · guided",
      "category": "Library",
      "platform": "web",
      "route": "/routines/[id]",
      "currentRoute": "apps/web/app/(tempo)/routines/[id]/page.tsx",
      "sourceFiles": ["screens-2.jsx#ScreenRoutineDetail"],
      "status": "scaffold",
      "owner": "claude-web-library",